<?xml version="1.0" encoding="UTF-8"?>
<!DOCTYPE factura SYSTEM "ejercicio2.dtd">


<factura numero="27" fecha="18/12/2013">
<emisor>
<nombre>libreria perez</nombre>
<cif>44555666B</cif>
<telefono>777888999</telefono>
</emisor>
<cliente>
<nombre>biblioteca txanterea</nombre>
<cif>33111222A</cif>
<telefono>333999444</telefono>
</cliente>
<detalle importe="300">
 <linea codigo_articulo="AW7" tipo="Libro">
         <descripcion>Analítica Web 2.0</descripcion>
         <cantidad>1</cantidad>
         <oferta></oferta>
         <pvp>25</pvp>
      </linea>
      <linea codigo_articulo="CP5" tipo="DVD">
         <descripcion>Curso de HTML</descripcion>
         <cantidad>2</cantidad>
         <pvp>30</pvp>
      </linea>
</detalle>
</factura>